relevancy_score	text
0.397060	Context: I’m a CS major admitted to UCSB, sent them my SIR. Was just accepted off waitlist at UCI also for CS and now have until this friday to SIR for UCI. Im very of an outdoorsy person(hiking, backpacking, camping, skiing, and especially surfing which i go 3-4 times a week) Personally not a party person too much and im definitely much more academic. Not gonna say im vigilantly anti party but definingly on the much lesser end of that scale. Im currently leaning towards SB, just because i visited SB and not UCI, though I could maybe visit this week unofficially.
0.397060	* Location. More scenic, visited last month, unlike anything I’ve seen in california; mountains right next to ocean, etc. * Social life, ppl seem more outgoing and just easier overall. * Smaller class size for CS or so im told * Stronger research wise?
0.397060	* party school reputation. I’m a core believer that you can find your people almost everywhere, but this is still somewhat of a factor. * farther from home(4-5hrs) * Worse surfing, somewhat of a factor for me but not defining. Its the main thing I do outside school. * isolated/industry connections, again this is a bit of a gray con. * housing crisis, goes for all uc’s but extentuated at SB. I was told that 2nd year housing should be looked at around November 💀
0.397060	* know decent amount of ppl going there, potentially have a good friend as a roomate. * Prestigiously stronger? IMO theyre both relatively the same but I thought I would include. * closer to home(1 hr) * better surfing * My dad works in irvine 3 days a week and has an apt there.
0.397060	* socially worse/more inactive. Again let me reiterate that I think you can find your own ppl everywhere, but I do believe it would be harder than UCSB but idk. * Larger class size * Seems more boring than SB, i’ve read its a commuter school rather than college town. * Less Diversity, decently important to me.
0.397028	UCSB Waitlist Questions
0.397028	I'm on the waitlist for CS.
0.397028	I was wondering if anyone has gotten off the waitlist for CS this year and if people are admitted from time to time by major or just randomly.
0.397028	I also saw that there's a place to submit transcripts but that's optional until you're accepted and decide to enroll. Would me submitting my transcript there mean that they get to see my senior year grades while reviewing my waitlist app again? (that would be a positive for me if they did.)
0.397028	Lowkey really hoping I get off this waitlist.
0.396207	Mandatory inspections on Oceanside DP houses this summer?
0.396207	What does this mean for people living there?
0.396115	Mandatory housing inspections on oceanside dp coming up
0.396115	Mandatory housing inspections on oceanside dp coming up
0.395521	Undergrad CE
0.395521	I recently got into ucsb for ce and am committed. i was looking at the classes and i am lowkey not trying to take 4 physics classes and i also kinda wanted to transfer into cs in the first place. how hard would it be to move from ce --&gt; cs
0.393095	Acceptance letter
0.393095	Can this letter with confetti be considered as a document or official acceptance letter? It does not even have a name of mine.
0.393001	sphere house
0.393001	i’ve always seen the sphere house in isla vista and it’s so beautiful. spheres are my favorite shape and i really really want to go inside before i graduate!!! i would give a kidney just to experience the sphere for 5 minutes
0.391356	Econ + What major?
0.391356	whats a good double major with econ who wants to go into banking or consulting? I've heard about the TMP program but don't know too much about it. would econ + financial mathematics be a good idea?
0.646304	Warning for University Housing Sierra Madre
0.646304	There is a construction of a town house/ apartment and it’s been going on the whole year. They work 7 AM to 6PM from Monday to Saturday. The sound of their drills and hammering will wake you up . The bantering in Spanish, the sing alongs… you will hear them all. “Adios Amor” in your face when you have a midterm tomorrow. The price is the same. The construction is 5 feet away from your balcony. You have been warned.
0.390949	Transfer housing question
0.390949	Quick question. I applied for housing already, and i remember reading somewhere that you can rank the places you’d want to go. I havent been able to find anywhere where i can do that, is it really just a pure lottery self selection system?
0.390856	math gen ed credits
0.390856	can calc BC (2 course equivalent) and ap stats (1 course) fulfill the entire math gen ed (3 courses)? or can i only apply one AP test to that subject area?
0.390856	if i can only apply one, that means i'd have 2 courses done from calc bc and would need to take one more course. some online pdf says "Courses should be in a single discipline and should be sufficiently broad to provide a base of knowledge about the discipline." does that mean my third course has to be calculus based??? or can i venture out and try something like comp sci or data science?
0.600890	UMD vs UCSB
0.600890	I was admitted off the UCSB waitlist today for Computer Engineering and am unsure whether to take it over UMD.
0.600890	I have in-state tuition at UCSB, and a $15,000 scholarship yearly at UMD(provided I maintain a 3.2 GPA).
0.600890	At SB, I am directly admitted to Computer Engineering but at UMD I was admitted to L&amp;S(need a C- in chemistry and B- in physics and calc credits I already have to transfer). I am unable to take engineering related courses until I transfer.
0.600890	As far as I can tell research, internship and career opportunities are roughly equal.
0.600890	For me, my two main concerns are my classmates and peers. I know SB has a reputation as a party school and i'm not sure how true it is and how much it would affect me. But I tend to be influenced by peers and it would help to have friends that push you academically as well.
0.600890	The proximity to home is nice because I enjoy the scenery california has to offer but i've visited and would be okay with UMD, so I'd like to base the choice mainly on academic factors.
0.600890	Any advice/opinions would be appreciated.
0.390485	Gen Ed Requirements Question
0.390485	Hi, when I was looking at the [sample schedule](https://engineering.ucsb.edu/sites/default/files/24-25_GEAR_DIGITAL.pdf) for Computer Engineering, I saw that only 7 G.E's were in the schedule, but according to the "general education" section you need at least like 10 courses on G.Es? Will I need to take more G.E's than what's on the schedule? Thx
0.390043	UCSB Merit Scholarships
0.390043	Hi, Was recently admitted to UCSB off the waitlist and I saw that UCSB awards merit based scholarships after 1 year. I was wondering how you would have to perform in order to receive these scholarships.
0.390043	thanks!!
0.389954	Econ and Accounting Major
0.389954	I am a transfer and want to major in econ and accoutning. I was looking at the transfer roadmap and see that the highest acct class is intermediate. I was reading and see that ucsb should prepare you for the cpa exam but why are we not required to take cost acct or advanced acct and other acct class?
0.389605	Diveristy
0.389605	Are there a good number of asians here? I want to come here but i here there's alot of white ppl...
0.389083	Student Commuter Club
0.389083	Hi all, my friend and I are hoping to start a club geared towards commuters. We’re hoping to start meetings in fall or winter quarter of next year, we’ll probably do activities like game nights, beach days, hikes etc. if you’re a commuter looking to meet other commuters we’d love your input with this survey.
0.388835	Bake Sale PULL UP
0.388835	TUESDAY AND WEDNESDAY, SELLING COOKIES AND BROWNIES FOR A GOOD CAUSE
0.388528	Incoming student, could use some help regarding AP credits
0.388528	I'm an incoming Class of 2029 student at the College of Letters &amp; Science planning to major in Economics and hoping to do a Statistics + Data Science double major.
0.388528	I'm wondering what AP courses I will get credit for at UCSB/what general education classes I can skip.
0.388528	These are the exams I will have taken by the end of high school and the corresponding units/courses according to this catalog. [https://catalog.ucsb.edu/pages/z4bq6o92J2KP8EOUPArd](https://catalog.ucsb.edu/pages/z4bq6o92J2KP8EOUPArd)
0.388528	Calculus BC: 8 units, C 2 courses
0.388528	Environmental Science: 4 units, C 1 course
0.388528	Microeconomics: 4 units, D 1 course
0.388528	European History: 8 units, E 1 course
0.388528	Computer Science P: 8 units, C 1 course
0.388528	U.S. Government: 4 units, D 1 course
0.388528	Macroeconomics: 4 units, D 1 course
0.388528	Statistics: 4 units, C 1 course
0.388528	Physics 1: 8 units, C 1 course
0.388528	Computer Science A: 8 units, C 1 course
0.388528	Does anyone know where I can find information about which of these courses I would get AP credits for assuming I score a 3 or higher on all of them?
0.388504	Most affordable housing
0.388504	Hi everyone, I was wondering what the most affordable, safe and reliable housing would be for Santa Barbara. I'm a transfer student who got accepted into this University, but I'm worried about the housing prices.
0.388407	i hate my roommates
0.388407	So basically like I’ve kinda been fine with them since I started here. This is my first year btw. but then I got into an incident with one of them in which now we do not speak. My other roommate stopped speaking to me as well. They only speak to each other while im just here in my own world. I don’t mind it or anything but they have zero respect or consideration. Whether I’m trying to nap or sleep they always speak loudly and never shut up honestly. They are loud in the morning and it just pisses me off. I used to be considerate while they were sleeping but I can’t get the same respect back. Now I don’t care if they’re sleeping I’ll be loud. They’re a bunch of pussies honestly and I hate them. I wish I never had them as roommates in the first place. School is almost over but I honestly was considering on changing rooms just to get away from them. If I could I would literally throw hands but I can’t risk my education. Should I continue ignoring them or what?
0.388305	tell me the BEST things about this school
0.388305	as an incoming freshman in the class of 2029, i need to know what's true and what isn't because it feels like the cons of going here have been blown WAY out of proportion. literally scared to look at the post with the cons. pleaseee go crazy and convince me i made the right choice 🙏
0.388146	Stats and data science majors who graduated with no internships wyd now?
0.387677	Student Commuter Club
0.387677	Student Commuter Club
0.387553	What are independent study courses? (like ME 197)
0.387553	I'm an engineering student who wants to work on some kind of project over the summer. I saw on GOLD that there's a class for independent studies design, but I don't really know what that means. Do I have a project ready before emailing a professor, or does a professor recommend a project? Can someone who has taken this course before (or a similar one) give their experience?
0.387354	Transfer from Letters and Sciences to CSS
0.387314	Think I’m losing my F-1 student status
0.387314	I’m an international student and since I never took below 12 units, I wasn’t aware of this problem so I took only 8 this quarter because I only need 8 to graduate. Nothing went wrong until I was trying to transfer my SEVIS record lately to my grad school and it was just now OISS told me I need at least 12 to maintain my F1 student status. It’s impossible to add any class right now so should I petition for deficit load or what? I have emailed OISS but I genuinely don’t know what else I can do now.
0.385609	Receive Up to $260 in Gift Cards!
0.385609	The University of Houston’s Research on Emotion, Substance Treatment Outcomes, and Racial Equity Laboratory (AHRL) is recruiting Latinx adults to participate in a 14-day **ONLINE** study using a mobile app to examine how ethnic microaggressions influence hazardous drinking. Participants can earn up to $260 in electronic gifts cards. For more details or if interested, email [ahrl91@cougarnet.uh.edu](mailto:ahrl91@cougarnet.uh.edu).
0.385517	New Club
0.385517	Hello guys i was thinking of starting a club or conference or exhibition for women with small breast. Im talking bouta like 32 max maybe 34 on a good day. Idk im just feeling left out like I look at everyone else and i just am defeated by my lack of breast. Anyway let me know
0.385200	MCDB 111 over summer with thrower?
0.385200	I’m going to take MCDB 111 human physio over the summer in session B but I’m also going to be taking 2 other classes that session, an online Art history GE and a poli sci class
0.385200	Is this doable? 😭 I’ve had friends take it during the year but I’m not sure how it’ll be in a 6 week session with 2 other classes
0.385163	UC Santa Barbara Gauchos Squirtle
0.384850	Last Minute Grad Pics?
0.384850	Hi guys! I’m a graduating senior and while I originally thought I didn’t want photos, I’m realizing that I will probably wish I had some years down the line. I was wondering if anyone would be willing to let me book them for a session in the coming weeks, (preferably before the end of week 9.) I was just thinking about some pictures in the library, entrance gate, and the ocean. If anyone is willing to help me out I’d really appreciate it!
0.384850	P.S. If any sweet girls want to let me know where they’re looking for their cute white grad dresses I will be forever grateful &lt;3
0.384162	Housing and Car Permits
0.384162	Im commuting rn at a different school so I don’t really have this issue but I’m thinking of transferring in my junior year and I was wondering… how does housing and getting a car permit work? is it really as hard as people say it is? or if i apply early i’ll be fine? what’s the best way to find my roommate to live with? or is it random? (p.s. yes ik a lot of people say you don’t need a car but my parents were saying they want me to be able to drive home if i need to asap (i live a couple hours away) and im usually the designated driver… but if i wouldn’t get the permit it’s not the end of the world lol)
0.384024	Housing
0.384024	Hey everyone, I'm an incoming transfer for this fall 2025. I'd like people to give their insight on the pros and cons of the housing options at UCSB. Please leave your input, as I'm sure it'd help many freshmen and transfers.
0.384024	I'm personally looking for a good quality housing option with a present social life.
0.383992	FYI for Incoming First Year Students - UCSB Parking Policy
0.383992	No parking for First Year UCSB Students, The Daily Nexus article: [https://dailynexus.com/2025-05-03/parking-permits-prohibited-for-first-year-students-next-academic-year/](https://dailynexus.com/2025-05-03/parking-permits-prohibited-for-first-year-students-next-academic-year/)
0.383950	FYI for Incoming First Year Students - UCSB Parking Policy
0.383741	Transfer from Letters and Sciences to CCS
0.381375	gender inclusive housing question
0.381375	on the personal preference survey for dorms (incoming freshman), there's a few questions regarding gender inclusive housing. i would be totally fine with a transfem roommate (i'm a cis girl) but not someone who is transmasc for the same reasons i wouldn't want to dorm with a cis guy and don't know which i would be getting myself into if i agreed to gender inclusive housing.
0.630199	Has anyone noticed this house in the shape of a circle in IV?
0.620360	Indecision Blunders - Pardall Carnival
0.620360	Hi hi! I won a hoodie at the Pardall Carnival Giveaway Wheel thingy and I foolishly made the safe split second decision to ask for a black hoodie completely forgetting to take into account that I DO in fact own a black hoodie and own multiple articles of black clothing.
0.620360	Anywho if anyone with a L or XL blue or beige/cream hoodie is willing to trade for a L black hoodie I would really appreciate it. I’m trying to step out of my comfort zone in regards to clothing :) Anywho thank you for coming to my TED Talk!
0.376413	22 yr old cc transfer joining sorority
0.376413	hi! I’m an incoming community college transfer attending UCSB for Fall 2025 quarter and I really want to join a sorority. I am wondering if I am allowed to formally rush or do COB because I’m 22.
0.000000	22 yr old cc transfer joining sorority
0.376044	Need to fix computer screen
0.376044	Any recommendations on where to get my laptop screen replaced?
0.375882	E-scooter repair?
0.375882	Hi! My e-scooter needs its rear tire replaced and my partner says we don't have the tools to do it at home (I have a replacement tire, just not the necessary tools). Does anyone know of any local places that can take care of this? (The UCSB bike repair place does not do e-scooter jobs.)
0.375854	fall ‘25 schedule
0.552438	transfers from other UCs - questions on pros and cons
0.552438	I'm trying to get feedback for my son ( he is not a reddit user ) as he recently got accepted to UCSB as a junior transfer. He's studying economics at UCSC. He also got accepted to transfer to other UC(s) : Davis, Irvine, San Diego
0.552438	I understand everyone's journey is different and responses are subjective.
0.552438	Was curious why you chose UC Santa Barbara?
0.552438	Thank you
0.375534	best freshman residence halls?
0.375534	I just got off the waitlist and am anxious on what my options are for housing as a freshman.
0.375534	For people who have lived in the freshman residence halls, which hall did you live in, how was the experience, were you a single, double or triple, and do you recommend a certain building of residence hall?
0.375534	Also, are there certain residence halls that usually get picked first, compared to others that are more popular that i should know about!
0.374440	UCSB vs UCLA physics undergrad!?!?
0.374440	Hi guys. I'm currently committed to UCSB l&amp;s for Physics and waitlisted at UCLA for the same thing as well. I wanted to make this post to ask abt the physics program here so I can better decide between the two schools in case I am somehow admitted off the ucla waitlist. Some questions for physics majors or just anyone else who has input:
0.374440	1) How good are research and internship opportunities in SB? I understand that it is kinda a little far from bigger cities, so is there still a sufficient amnt of companies in the area that offer research/internship opportunities?
0.374440	2) Are lower division classes large? If so, is it still possible to connect with professors? Alot of ppl say to visit during office hours to make friends w professors... what exactly are office hours like?
0.374440	3) Would it be possible to double major or minor in smth like stats/data sci? I wanna have a fallback plan in case I don't pursue grad school, so I thought having courses in smth more practical would be maybe useful for getting a job right after my bachelors.
0.374440	4) Also considering trying to switch into college of engineering for mech or chem e... which is hard asf from what ive heard. If anyone has stories, advice, experience, or insight on this it would be much appreciated :)
0.374440	5) Any insight at all about if there are any big differences between SB and LA for Physics!
0.374440	Tysm in advance for taking the time to read or response to my post thumbsup
0.373794	earth7 midterm
0.373794	i know we're allowed to have a cheatsheet front and back but is professor moore going to be providing the cladograms handouts or do we have to memorize them?
0.373793	ksig parties
0.373793	how do i know when they are
0.000000	ksig parties
0.373519	Ichiba or Palaniappan for PSTAT 160A?
0.373519	I am currently looking at which 160A professor to take next Fall and I am still unsure which to pick between the two. If any have taken either for this course, please let me know about your experience in the course
0.373492	Love it....
0.373170	Study spots
0.373170	I’m tired of how crowded the library is and I want a new place to study. Is there anywhere in some of the newer buildings like the engineering or marine studies buildings to study at?
0.372987	Lost dog running near IV/campus
0.372987	Saw a German Shepard with a leash running on leash on colegio road towards campus. If he’s yours, a few ppl tried to grab him, he seemed friendly.
0.372873	TRUTH Act Forum 6/6 2pm
0.372873	Concerned about ICE? Come protest downtown at this year's TRUTH Act Forum where activists will demand our county Sheriff stop voluntarily handing community members over to ICE. There will be a protest at 2pm outside the County Administration Building 105 East Anapamu St in downtown SB.
0.372873	The TRUTH Act meeting of the Board of Supervisors will happen inside at 3PM and you can attend that too. When we attended the meeting about Sable's pipeline ownership transfer they voted against it even though their staff recommended voting for it.
0.372873	The protest event is hosted by Santa Barbara Indivisible. I am posting it here because I spoke with a young person on Saturday who said a lot of UCSB students want to get involved by they never hear about these things until afterward and that fliers are being torn down around campus.
0.372873	[https://bsky.app/profile/indivisiblesb.bsky.social/post/3lobsfb4cwm26](https://bsky.app/profile/indivisiblesb.bsky.social/post/3lobsfb4cwm26)
0.372795	Pitt vs. UCSB
0.372795	I recently got into both Pitt and UCSB for biology related majors. I plan to do premed and go to medical school and I am stuck between the two universities.
0.372795	I know Pitt has multiple research opportunities for premed and they have a great premed pathway. They also have challenging courses but the school culture is not too competitive. I love the campus and the environment but I am an out of state student so the cost will be around $60,000.
0.372795	Compared to Pitt I have heard UCSB does not have much clinical research and they also don't have a med school. However, I also like the UCSB campus and I am a CA resident so the estimated fees are less than Pitt, around $47,000.
0.372795	Would it be better for me to go to Pitt which has more research but is costly compared to UCSB which is closer and less costly? I know med school is extremely expensive and I don't want to start undergrad with a debt but I am also scared of not standing out because of less research and volunteering. Can anyone who has done premed at UCSB tell me your experience and if you would recommend it? Thank you!
0.372663	Missing keys
0.372663	Hey guys, I have lost my keys at around 11PM on Friday around the 66,67 block. It has an 8-ball keychain and an ucsb surfboard beer opener. If you happen to see or find it please lmk, there will be a reward for it thanks!
0.372019	Screaming last night
0.372019	Anybody here the guy last night at 4 am ish screaming his lungs off. Saying like “F-ck you” like a thousand times. I called police, he was yelling at them too. No timely warning or reports in the news yet. Anybody have any more info??
0.366826	Is ucsb and sb in general good for premed and prepa students?
0.366816	Is UCSB and SB in general good for premed and prepa students?
0.366205	Slo vs ucsb
0.366205	I’m torn between ucsb and slo because I love both campuses but I like the idea of living in slo better. I’m a film major at ucsb which is great and kind of a random major under liberal arts at cal poly slo. Do you guys like living in IV or does it feel isolating? I’m worried I’m just going to get bored if I can’t find friends right away as a transfer student, or is that not a factor I shouldn’t consider? I like to skate, play guitar, going to nature spots, and I want to get back into surfing which sb would be good for. I’d like to hear your thoughts!
0.366097	Whats the best Indian food in SB?
0.366097	Naan stop is good but its not that good
0.366052	TEDxUCSB 2025 is on Friday!!!
0.366052	Hi everyone! We want to bring your attention to a really exciting event happening this Friday. It’s the annual TEDxUCSB conference! This is a great opportunity to hear amazing speeches from undergrads, grad students, and general speakers alike! Our theme for this year is Mirror Image, and topics range from artificial intelligence to mental health to ocean conservation and more. There’s something for everyone!
0.366052	The event will take place at the Music LLCH on Friday, May 9th, at 6 PM and doors open at 5:30 PM. Tickets are free for students and $15 for everyone else; check out our website at [https://tedxucsb.com/](https://tedxucsb.com/) to buy tickets. There will also be free food! Please come, and bring your friends! DM me if you have any questions!
0.365040	How doable is it taking MCDB 126, 126AL, and 108A while at the same time taking CHEM 112A...?
0.365040	On paper, I will be taking 17 units in the fall and its not really a question on whether I should take all of these classes together because Im trying to graduate next year so I very much have to do it. The study load is making me really nervous so Im wondering if anyone else has done it and is willing to share any tips on how to prepare beforehand to make the study load a little less harsh.
0.365040	Ps, I will gladly take any advice, books, notes, websites, etc. Anything helps tbh!!
0.364592	Underground Training Facility Blood Drive 5/10/25 Goleta
0.363580	Roommate Help- How are the dorms, and how likely are double dorms??
0.363580	I just got off the waitlist yesterday and am still deciding if i want to go, but tbh a big deciding factor would be how the dorms are at ucsb??
0.363580	My dream was to only have a double dorm, but the more i research, the less likely that seems to be due to the small chance of getting a double dorm this late into signing up for housing.
