relevancy_score	text
0.363580	So, if anyone had a roommate they were considering rooming with that dropped out due to getting off the waitlist, please let me know and reach out because i would love to room! Here's my insta -&gt; @belleeq2
0.604423	Tailless Raccoon at SB Airport
0.604423	Think it was born that way or just seen some shit?
0.362320	UCSB waitlist wave yesterday?
0.362320	Did anyone instate get off the waitlist yesterday? If so, what was your major?
0.362254	PSTAT 120b resources
0.362254	Does anyone have any study resources / tips for PSTAT 120B? kind of struggling in this class
0.361664	Question Regarding Philosophy Diploma
0.361664	Hi, I'm still not graduating for another entire year, but I'm double majoring with the Ethics &amp; Public Policy concentration and was just wondering if anyone who's graduated can tell me how it would "look".
0.361664	Would it just say "Philosophy"? "Philosophy w/ a concentration in Ethics &amp; Public Policy"? Just "Ethics &amp; Public Policy"?
0.361664	Just curious! Thank you.
0.360516	Biopsych/PsyB people please help
0.360516	I am deciding btwn transferring into UCSB and another uni (UCSD) I’m admitted pre Biopsych but I still need to take a few lower div prerequisites (chem II &amp;III, bio II &amp; III) and some med school prereqs (ochem, biochemistry) I know I should have gotten these out of the way b4 transfer &amp; im trying to this summer
0.360516	Would anybody be willing to help me figure out if I can realistically keep up with UCSB Biopsych (or PsyB or Bio B.A. if I end up switching) upper divs + remaining pre requisites and be able to graduate by spring 2027? (2 yrs from now)
0.360516	Thank you so much for the help I would love any advice from people in these majors or fellow transfer students from other universities/colleges.
0.356392	Do people play beach volleyball all day here?
0.356392	I am a transfer student who was recently admitted to ucsb and a couple other UC schools. While on a guided tour they took us past dorms filled with people playing beach volleyball and said this is a daily occurrence. While that does sound like paradise, my question is… do people actually just party and play beach volleyball all day? The way the tour guide advertised the school it made it seem like it was a very relaxed environment, and I am wondering about the academic rigor of the school. For context, when I went to UCSD to look at the campus everyone said it’s really rigorous and lowkey socially dead(lol). I’m wondering what the general work life balance is.
0.356392	Do people play beach volleyball all day here?
0.355946	Are they taking off the waitlist?
0.355946	Waitlisted for Electrical Engineering Wanted to know when they will send email for acceptance or rejection
0.355931	Is someone interested in dorming in a quad at Santa Rosa?
0.355931	I’m an upcoming female freshman and I was wondering if there are any other girls interested in living on a quad on campus?
0.355867	CS and Linguistics (Language and Speech Technologies Emphasis) Double Major/Minor
0.355867	Hello! I am an incoming freshman that'll be studying Computer Science at UCSB. I recently came across the Linguistics major with an emphasis in language &amp; speech technologies. I am pretty interested in learning about linguistics, and I'd especially like to explore the intersection between Ling and CS. Thus, I am considering double majoring or minoring in Linguistics.
0.355867	Is anyone majoring in Linguistics with this emphasis? Or double majoring/minoring in CS? If so, I have a few questions!
0.355867	How would you rate the linguistics classes/professors here? Any classes you particularly enjoyed?
0.355867	How is the balance between pure linguistics classes and more technical/computational courses?
0.355867	How well does knowledge translate between CS and Linguistics? Do courses in both subject areas better your understanding of fields like NLP/Computational Linguistics?
0.355867	Would it be difficult to try to finish all of the requirements for both majors in 4 years? I have quite a few AP credits so would this help ensure this is possible/ease my course load?
0.355867	Thank you!
0.355114	Creepy fat guy recording in front of bus loop
0.355114	Does anyone know what his deal is? He kept staring and didn't say hello back or why he was filming openly.
0.000000	Creepy fat guy recording in front of bus loop
0.354886	Noisy ass neighbors
0.354886	I live next to men. The walls are already so thin so I can always hear their conversations fully at night. For months since Fall, I can hear them playing video games together, which honestly I don’t care about. It’s always loud yelling but it’s a college apartment so I can’t complain on that part. What really pisses me off is them banging on their desks. One of them rages when he’s losing video games and starts slamming his door, banging on his desk like a maniac, yelling, and even bangs on the wall next to me so loudly that it shakes my entire room. It sounds like a body slamming all across the wall. This has been happening for months on end, and every time I report it to the RA, they just knock and say to be quiet. Gee thanks. To add onto that, when we pass by their apartment, it REEKS. Please send help haha.
0.353712	UCSB Econ 140a
0.353712	Anyone taken this class with Vazquez-Bare Or currently taking it. How did you guys study for this class? Does he normally do a curve at the end after dropping one of the exam?
0.353291	Has anyone worked on WORD Magazine?
0.353291	Thinking of taking the class and wanted to hear from someone who’s been part of it, what was your experience like? Any insight would help!
0.352976	New UC President
0.352976	James B. Milliken will be taking over the position of Michael V. Drake as UC President starting in August.
0.352927	Any updates on the IV shooting in March 2025 by Jackson Kyle Jue?
0.352927	Is the victim OK? Was there a motive? Thanks.
0.352736	Transfer housing advice, incoming FA 25 Transfer
0.352736	Just wanted to come on here and see what the consensus route was when going about transfer housing. I was thinking of staying at one of the undergrad apartments and was just wondering what I should know about the apartments and if anyone had any suggestions or recommendations for them! Appreciate any info at all thanks for the help!
0.352474	Activities to do alone
0.352474	Hey guys! Im a 3rd year and it’s the first time I don’t have class on Fridays but most of my friends do, so I want to try out some bucket list things in the afternoons and I’m wondering if anyone has any suggestions. Must try food places? Easy day trips? Let me know!
0.351481	rocky horror show
0.351481	Hi guys. Im trying to buy tickets for the show next week through the link on their insta page but when I put in my perm number nothing happens. does anyone else have this issue? should I message their page?
0.351344	Facebook Roommate Groups for Undergrad Apartments?
0.351344	I just signed an undergrad apartment contract for this summer (both sessions) and was wondering if there are Facebook groups for university owned housing. I only know of the ones for Isla Vista. I'm trying to find a roommate for a double room. My only requirements are that you are clean, don't smoke/vape, and are quiet at night when I am sleeping. Obviously I will reciprocate all of these things. I like to hang out with my roommates (hike, watch movies, get food, etc.). If anyone on here is interested in rooming lmk.
0.540127	Pardall Carnival
0.540127	Y’all should go to Pardall Carnival this Sunday May 4th, if you want to have free food and listen to some IV bands for free.
0.351082	Pardall Carnival
0.350574	Mystery man seen in last image of dead California freshman Liz Hamel identified
0.584068	Red Heel is missing, apparently a UCSB frat has it
0.584068	I saw this article (i’ll link in comments) talking about how the red heel was probably stolen by some frat house
0.350280	Graduation Cords
0.350280	Anyone know any cords you can get for graduation? There really isn’t much information on them so was wondering if anyone else had any idea.
0.350062	Amid Increasing Public Attention, UCSP Police Department’s IG goes private
0.350062	Who do they think they are? Why does a government instagram account turn private?
0.349962	Petition for writing credit
0.349962	I’m a CoE student, is there any way to petition to receive writing requirement credit for a course I’ve taken that wasn’t approved beforehand? I know L&amp;S has that petition, but I can’t find a similar one for CoE.
0.349823	PSY 110-195
0.349823	Does anyone know where I can find out what these classes are? I’ve been trying to find a catalog but genuinely cannot find one at all. Thank you!
0.348529	Got waitlisted, but I’m not sure if I’m getting my first choice major or second
0.348529	As ya’ll know CS acceptance for undergrad is a bloodshed to say the least, unfortunately, I got rejected from around 15 schools, some were reach, and some were less competitive, I may not be able to attend my safe school either for personal reasons.
0.348529	I appealed at one school. and I’m only waitlisted at UCSB My first choice was CS, my second was stat and DS
0.348529	And I just realized that it’s the only second choice major that isn’t engineering that I applied for at any school, and it might be why I got waitlisted? Because I’m being considered for the second choice?
0.348529	I know that the waitlist acceptance rate is really great but I also know that CS is competitive
0.348529	do you guys think I’ll get in first or second choice?
0.348529	If it matters, I’m an international student UW GPA: 3.95/4
0.348529	SCP senior year Math TA 2 years 1 research, 1 internship Small business owner Made a simple website and some small related projects
0.348529	1 gap year (applying as a freshman) explained that I attended another university for a year then i fully withdrew for a valid reason, strong GPA, joined clubs + research team
0.348529	worked two jobs after HS (related to DS)
0.346474	somebody was screaming "help" at 2:10am
0.346474	Somebody was screaming "help, help me" around 2:13am somewhere on El Colegio Rd. I called the non emergency line and they said the police were already with the victim. Does anybody know what happened?
0.553000	Amid increasing public attention, UCSB police department’s IG goes private
0.345625	Amid increasing public attention, UCSB police department’s IG goes private
0.345625	Who do they think they are? Why does a government instagram account change to private? Please help.
0.345296	Which Professor Should I Take For CHEM109A
0.345296	I'm taking CHEM109A for fall quarter 2025, and I'd like to know whether I should take Lewis or Read de Alaniz.
0.345296	I already know that CHEM109A is going to be very hard, so I was just wondering who teaches the best / who's exams are easier.
0.345177	Linguistics (Language and Speech Tech) — any insights? Considering double major + 3-year grad plan
0.345177	Hey! I’m an incoming freshman and still trying to figure out my major. I’m interested in the Linguistics BA with the Language and Speech Technologies emphasis, but other than the official website, I can’t find much real info or student experiences.
0.345177	If anyone here is in the program (or knows someone who is), I’d love to hear your thoughts on things like:
0.345177	• How much programming/coding is involved?
0.345177	• Are the courses well-organized?
0.345177	• What are the professors like?
0.345177	• Are there good research opportunities in this area?
0.345177	• Does it prepare you well for grad school or industry jobs?
0.345177	• Is it possible to finish this major in 3 years?
0.345177	• Is double majoring with this doable?
0.345177	• If so, what are some good double major/minor combinations?
0.345177	Thanks a lot in advance! Any tips, advice, or personal experiences would be super appreciated!
0.344765	Rushing
0.344765	Hi, I was thinking about rushing as a second year in the fall. How is the process? Do I need to create a resume and do I need rec letters?
0.344260	An Update on the Liz Hamel Incident!
0.344260	Just now!
0.344234	Interning at UCSB this summer for 10 weeks
0.344234	Hello! I need to sublease but I’m not a UCSB student (I’m from the east coast and I’m doing research at UCSB from June 1 - August 10). If anyone has any leads let me know! Facebook is kinda sketch at times but I’m on there too. Feel free to message me though! #UCSB
0.344061	Need Grad Tickets Sat 1pm
0.344061	Anyone got extra tickets?
0.342812	[ART 117] Anyone got photo refs of the animals for the assignment due tonight?
0.342812	I just need two more animals at different perspectives. Thanks
0.342407	Housing opinions?
0.342407	Hi! I am a transfer student going into ucsb and needed everyone’s opinions. Should I go for an undergrad apartment, or an off campus, more spacious double? My budget has been around 1000/1100 ish, but cheaper would be nice. I just have been so anti undergrad apts idk why, I just feel like the choices are stressful and limiting. I have found nice, spacious off campus Facebook posts that I am going to tour, but I am wondering if I am making a financial/overall mistake.
0.342379	Hey Transfer Students!
0.342379	Help Me With a Survey Transfer Students!!!!
0.342379	Attention Transfer Students: Please complete a short survey (part of ES’s ELI course) for a chance to win a $25 amazon gift card!
0.342379	My name is Isabella, a 4th year transfer student at UCSB enrolled in the Environmental Studies Environmental Leadership Incubator (ELI) class, and I want to hear about your experience when you first arrived at UCSB!
0.342379	As a transfer student, adjusting to a new environment—academically, socially, and physically—can be exciting but also overwhelming. I'd love your input on how you connected with UCSB’s outdoor spaces and community when you first got here.
0.342379	Please take a short survey to share your thoughts:
0.342379	Your feedback will be incredibly valuable in helping me develop a project aimed at making it easier for transfer students to explore UCSB’s natural surroundings, connect with the local environment, and build a sense of community.
0.342379	Follow me on Instagram or GroupMe if you want to know more about events!!!
0.342379	Instagram @ucsbhotby
0.342379	GroupMe https://groupme.com/join_group/107145148/TCCxWcoB
0.342379	Thank you for your time—I appreciate your insights!
0.342366	Suspected of AI
0.342366	I have a teacher who thinks I used AI on an assignment when I literally didn’t and she is going to give me a 10 minute oral quiz. Only problem with that is I haven’t been to class in a while and the only stuff I know about the class is what I wrote about. What do I do?
0.341830	2nd Year Bio Majors
0.341830	Thoughts on taking taking ochem, biology, AND physics all throughout your sophomore year? It seems like it would be way too overwhelming and impossible to balance + do well in, but that's what the bio department recommends for undergrads..
0.341382	101 midterm
0.341382	101 midterm
0.341382	Bombed most of the free response, the math got me. anyone else?
0.454652	Psychology program
0.454652	Hi! I’m pretty young to be looking at colleges, but I’ve had my eye on UCSB for a few years now, and I’d like to get as much information as I can as early as I can.
0.454652	I have been interested in psychology for a very long time, so I was wondering what the psychology program there is like and how good it is!
0.454652	Thank you!
0.340287	Employment at the University post-grad
0.340287	I know there’s a limit of 1 quarter that a graduated student can continue working for the University, but I finished classes in Winter and have just been doing research here all quarter and I want to continue it into summer. Is there any way to petition to get an exemption for this? Has anyone ever dealt with this before?
0.523457	Need a Roommate
0.523457	Hey we (3 guys) are in need of more roommates for a roomate group. Specifically people who want to fill a triple and then another person for a double. Let me know if you’re interested! We’re planning on living in the SJ towers!
0.339982	Biochem
0.339982	How is the biochem major here. I am a transfer student and just curious what people think.
0.339814	Looking for an available room during fall and winter quarters
0.339814	Hi everyone! I'm a 22M computer science student from Norway, and I'll be attending UCSB for the upcoming fall and winter quarters as part of my exchange year. I'm currently having some trouble finding housing (yes, I know I'm a bit late...), so if anyone happens to have a spare bed or knows of a place, I’d really appreciate it if you could send me a DM!
0.339814	A bit about me: As a computer science student, I’m of course passionate about technology and programming. I play drums in a couple of bands, guitar on my own, and I also enjoy bouldering regularly. I'm always up for a good time and never say no to a party, though I wouldn’t call myself a hardcore party animal. On top of that, I have a huge love for movies.
0.339814	Looking forward to meeting some of you soon!
0.339659	What’s your selection date and time for university apartments?
0.339659	Basically what that title says, for those of you living in university apartments, when is your selection time?
0.338982	Best housing options closest to campus?
0.338982	No budget. What are some of the best off campus housing?
0.498503	Best housing options closest to campus?
0.336780	Anybody donating or selling their bike since they are graduating?
0.336780	I am an upcoming sophomore and willing to buy a bike but looking for cheap ones. just dm me!
0.334330	Computer engineering to Computer science
0.334330	I just got accepted as a transfer for computer engineering but I was wondering if anyone has switched majors from computer engineering to computer science? I really don’t want to take EE classes tbh I wanted to take more CS classes and from a logical standpoint, if CE has priority enrollment in CS classes anyways, would it even make a difference if I was CS vs CE in terms of like department/class size restrictions? Thanks
0.334090	How well is the pre-health community at ucsb?
0.334090	Title! Help a girl out HAHA I just committed and I want to def get those clinical internships, jobs, and anything related to medical so I can get into med school!
0.334035	Whats the best place to eat on campus, and what do you avoid?
0.334035	I'll likely be transferring here in the fall so just wanted to see what's good.
0.333441	Earrape in the gym?
0.333441	Why? We all have headphones? Plz just put in your own headphones ur getting paid to move weights ffs
0.333362	Transfer housing recs?
0.333362	Me and my buddy are transferring to UCSB and we think we gonna go with El dorado housing because to our knowledge that and westgate are the only ones with a one bedroom option. We don’t want to room with other people this year. Is El dorado the move? Any other info or recommendations we should consider?
0.333350	A2f church
0.333350	Be careful of a2f church. They will be super friendly and give you lots of free food and seem super extremely nice but it’s a very off vibe. I finished course 101 (very polarizing and hateful) and it literally just bashed atheism and claimed that Christians “did more than any other culture or social movement for people.” They do not spread a good message for Christianity about love and acceptance, just that Christianity is the “most true” or “did the most good for the world.” I would not affiliate with the church or its people.
0.333004	His Final Goodbye
0.332651	is the CS acceptance rate really 5%?
0.332549	I NEED ADVICE PLEASE HELP !!!!
0.332549	So I am a senior in highschool and was admitted to Computer Engineering at UCSB. However, in highschool the only AP exam so far I have passed is AP Psychology. I am now taking 5 additional APs, 3 which I am confident about but these other 2, AP Biology and AP Microeconomics not so much. I am now on a time limit on what to study. Can yall tell me please which one out of those 2 is best to study on and pass according to my major Computer Engineering (so like whats best to pass to either get GE's out of the way or to get more college credit)
0.332470	Advice: Changing Major as a Transfer Student
0.332470	I was accepted as a transfer student for this upcoming Fall for Pre-Financial Mathematics and Statistics, which was my second choice - Computer Science being my first.
0.332470	In the acceptance letter they stated that "You may remain in the major to which you were admitted or select from numerous other majors available within this college. Please visit the [Major Changes page](http://admissions.sa.ucsb.edu/major-changes) to view those majors. Unfortunately, you will not be able to change back into your original choice major(s) at a later date. Thus, if you accept our offer of admission, it should be with the understanding that you will benefit from the Pre-Financial Mathematics and Statistics major, or another available major within the college, rather than with the expectation of changing into the major(s) to which you originally applied."
0.332470	Does this mean that there is no likelihood of me being able to change to Computer Science as my major either now or later in the school year? I was hoping to be able to attend UCSB with my accepted major and take the remaining required pre-major Computer Science courses at UCSB, then try to change my major to Computer Science.
0.332470	I was also considering trying to change my major to Statistics and Data Science, as I read that it might be more closely tied to my coding background than Financial Mathematics and Statistics.
0.332470	If neither of these would work, do you guys have any suggestions for how I should move forward regarding this situation? I would love to be able to continue having CS in my future, as I've been working towards a CS degree while at my cc. Is there any way for make this work out where I could attend UCSB and also still be able to be in the coding field? I'm glad to take advice from anyone, current student or not.
0.332375	super GE classes / Best GE classes
0.332375	what are some of the best lower division classes at UCSB that fulfil a bunch of areas and major requirements for pre-psych &amp; brain majors?
0.332342	How’s the Earth Science at UCSB?
0.332342	I didn’t get in for my main major, which was M.E and got in for my alternative as a transfer.
0.332342	I was wondering how the Earth Science department here at UCSB is?
0.332342	Even if I can’t change majors into the college of engineering, I still want to know a bit more about UCSB &amp; what it has to offer w/this major.
0.332252	Paid research at ucsb
0.332237	chem 1b midterm
0.332237	did terrible with a 24% on sylvesters midterm.... is there a way to recover and if so how. i do the practice tests, averaging 70-80's, and do all of the book problems. currently at a loss
0.332053	UCSB vs UCI vs Wesleyan vs Northeastern vs Cal Slo vs Grinnell (All for CS)
0.332053	UCSB Pros:
0.332053	Got in early with chancellors, so I get class registration priority.
0.332053	Great CS Program.
0.332053	Renowned for CCS (Will most likely try transferring to CCS computing. However, I heard it's pretty hard. I do kind of wish that I did apply as CCS.).
0.332053	Small CS Program.
0.332053	in-state - cost
0.332053	**Cons:**
0.332053	Not a lot of diversity compared to other UC's (10% asian i think)
0.332053	Near beaches and I'm not a beach person
0.332053	Housing crises
0.332053	Party school and I'm not a party guy.
0.332053	**UCI:**
0.332053	**Pros:**
0.332053	Amazing CS Program.
0.332053	Close to home (kind of a good thing)
0.332053	Already know a couple of upperclassmen friends who could guide me
0.332053	Less competitive for opportunities?
0.332053	Nice campus
0.332053	Honors college
0.332053	in-state - cost
0.332053	**Cons:**
0.332053	not really presitigious
0.332053	socially dead
0.332053	close to home
0.332053	**Wesleyan Pros:**
0.332053	Little Ivy - prestigious
0.332053	LAC - small class sizes, closer relations with professors
0.332053	more research opportunities
0.332053	open curriculum, great academics
0.332053	strong alumni network
0.332053	great grad school placement
0.332053	**Cons:**
0.332053	lack of diversity
0.332053	not really known for cs
0.332053	heard there's a drug problem
0.332053	**Northeastern pros:**
0.332053	\-strong cs program
0.332053	\-private school
0.332053	**cons**:
0.332053	diversity
0.332053	games the rankings
0.332053	**Cal Slo pros:**
0.332053	\-Prestigious for CS? Apparently it has a 3% AR for cs.
0.332053	\-Amazing recruitment. Heard it's better than some of the UC's.
0.332053	\-learn by doing.
0.332053	**Cons**:
0.332053	Very very very white.
0.332053	cost is similar to the uc's.
0.332053	less pretigious?
0.332053	**grinnel pros:**
0.332053	lac perks
0.332053	reputable academics
0.332053	**cons:**
0.332053	location
0.332053	diversity
0.332053	\*i also want to add that i might switch from cs to pre-med or political science but idk yet. I will most likely stick with cs; however, in the past couple of months, my interests have drastically changed. my goal is to get into grad school for either cs research, med school, or whatever. again, i haven't fully decided what i want to do. i think uci cs is a bit better than ucsb cs. however, If UCSB ccs is feasibile to switch into, then i will most likely commit there.
0.331808	Should I go to UCLA or UCSB
0.331808	Hi everyone! I recently got admitted as a transfer student into UCLA and UCSB! I'm super excited and grateful but I'm having the hardest time deciding between the two.
