relevancy_score	text
0.421135	1. How safe is it to spend the night at a nearby hotel (Best Western or Hilton for example) with the minivan full of stuff the night before moving into the dorms? Do we risk getting our car broken into?
0.421135	2. Is family weekend worth it? I've heard there's a lot of traffic, crowds, and waiting in lines. Would it be better to visit the weekend before and just have our daughter show us around?
0.421135	Just trying to get a jump start on hotel reservations. Thanks in advance for any insight!
0.420696	Need help finding a graduation photographer
0.420696	Hi I am graduating this term and I am having a hard time finding a graduation photographer. One of the programs I am in was offering one free of charge but this has changed and this has left me to find one. I need recs on a professional graduation photographer please!
0.420489	PS Anyone can fill out the survey!!! We’re gonna do fun stuff(beach day, zoo, game night etc)
0.417660	Pre-major Reqs
0.417660	I have admittedly fallen a bit behind doing my pre-major classes (I am a second year PBS major), and will get them done during the summer session B. My first question is, will I be able to have my change of major petition go through by fall quarter? My next question is, with fall registration opening soon, will I be able to register for major classes that require full major status?
0.417660	To clarify, I have already scheduled an appointment with an advisor. Just wanted to see if anyone one here had an answer. Thanks in advance!
0.417278	waitlist movement ?
0.417278	anymore waitlist movement happening?? i’m an international student &amp; applied for psych, losing hope every day 🥲🥲
0.416592	UCSB Post Grad Life
0.416592	A question for UCSB graduates: How’s post grad life treating you? Did UCSB help you with employment, research opportunities, network, career goals etc? Tell me everything I need to know!
0.416592	- i got admitted as a transfer student, debating between UCSD and UCSB
0.415855	Double Major
0.415855	I recently got into ucsb with a major in computer engineering and i cant wait to join in the fall ! Im super intrested in stats and I wanted to add it as a major. Would that be possible? My friend was telling me that adding majors (double majoring) at ucsb is really hard and i'd be really bummed if i had to take stats classes w/o getting credit for them as a comp e major. Also, how stressful would it be to double major? I really enjoy statistics but dont want to overload myself. Also, even if im a computer engineering major can I get research ops in the applied stats and datascience labs? sorry for all the questions!
0.415533	funniest/most interesting professors?
0.415533	Hey all- alum here (go gauchos etc) I wonder if any professors come to mind as particularly funny (at least just posessing a sense of humor)or particularly captivating(points for a combo!) from your time here (any major) (I was considering econ but honestly im pretty open) for an interview series im considering launching- Its a little daunting to simply look up random professors on rate my professor and a bit of a stab in the dark- I figured I'd go to the source- the students! Anyone come to mind instantly? thank you!
0.415295	Looking for Housemate (Single Bedroom)
0.415295	Hi! I am a UCSB biochemistry student (20M) and i just secured a lease in westside santa barbara. i am passionate about nature, my studies, and living well. the place is a cute cottage with 2 bedrooms, 1 full bathroom, a spacious kitchen, a patio, a small garden, and a washer and dryer in the unit. i am looking for a studious, clean, openminded, and respectful housemate to take the other single bedroom. No pets allowed sorry. 1 year lease, $1600 rent. No smoking indoors but 420 friendly outside. I enjoy camping, biking, hiking, music and traveling. shoot me a message if you think it would be a good fit!
0.414726	FSSP students have to stay in San Nicholas the entire year??
0.414726	I watched a video for FSSP 2025 and they say the students now have to stay in San Nicholas the whole year... I'm in CCS though, so I'm wondering if I can just request to switch to Santa Rosa?? (link to video if you're curious: https://www.youtube.com/watch?v=Y-XFsEGAcOc)
0.414726	Anyone have opinions on San Nicholas?
0.413622	changing majors within coe
0.413622	hello! i recently got off the waitlist for chemical engineering but i'm considering doing mechanical engineering instead. does anyone know if its hard to change from chemical to mech, or how difficult it is to switch within the college of engineering in general? i know the programs are small so i assume that would make it more difficult + id also have to commit for chem e and hope i could switch after. any responses would be appreciated, thank you!!
0.413146	uc davis or ucsb for premed
0.413146	i just got off the waitlist for uc davis for neurobio (an impacted major) and ucsb for pre psychological and brain sciences. i am on the premed track and im pretty stuck between these two. i am in the sac area and ive never really wanted to attend davis because its really close to home and on the other hand i know a lot of people from my school going to ucsb. the work hard play hard life and location of sb seems way better but i know davis is a premed school and they have an associated med school and plenty of hospitals in sac so the opportunities there would be better, but my heart is leaning towards ucsb. i talked to a premed friend at ucsb and she said there is opportunities there so its not like sb has nothing but im afraid that choosing sb over davis for premed is just like a dumb thing to do cuz theres prolly way more at davis, although, davis seems like they would have more competition to get opportunities because they have so many premeds. please give me advice 🙏🙏
0.413041	Why does Pardall feel like Rainbow Road after 10pm??
0.413041	I swear, trying to walk down Pardall late at night is like navigating a Mario Kart track on 200cc - dodging scooters, bikes, and that one guy on a unicycle blasting Skrillex. UCSB students: pedestrians or elite stunt doubles? IV tourists would fold in 5 seconds. Let’s all agree - helmets AND plot armor required.
0.412854	Favorite places to shit in IV
0.412854	1. Embarcadero hall 2. Woodstocks 3. Deja Vu HM: Dogshit park
0.412386	Tickets for the Maria’s SB Bowl 7/18
0.412386	Hey yall I'm selling my tickets for the Maria's at the Santa Barbara Bowl for this summer 7-19. I'm selling as much as I paid for them ($300) which is ~200 less than the going rate for the section. DM for more info I wanna get these off my hands
0.412227	ucsb or ucla or uci?
0.412227	hello i’m a transfer student who got accepted to ucsb for econ and accounting, and was wondering if anyone could give their two cents on the major? i also got into ucla for business econ and uci for business admin. my career goals for the future is to get into accounting! i’ve heard really good things about the ucsb major it in terms of employment but wanted to know more or even about campus life!
0.412227	some pros and cons:
0.412227	ucla-pros •the name of the school helps to bring opportunities •the social life is a lot more accepting for transfers and i have friends who have said nothing but positive things about it •the location of the school is perfect, i’ve lived in la all my life so i know id enjoy living there and there’s more opportunities there as well •the school has a lot of school spirit which makes it have the “college experience”
0.412227	ucla-cons •have to pay about 2k out of pocket each year •not guaranteed business econ until completing pre reqs •heard weeder classes such as econ 11 and 141 are difficult and tend to have students fail out the major to econ or alt major •not guaranteed admission to the accounting minor either •would have to have have at least one roommate but was hoping to have my own place
0.412227	uci-pros •has an actual business school that would have people help guide me during undergrad •admitted into business admin and can emphasize in accounting •really good financial aid covering all the costs •oc is a very safe place with a lot of nice places to explore •would have my own apartment
0.412227	uci-cons •not as prestigious as ucla •the social life isn’t the best with people more focused on academics or themselves. •might have to work harder to find opportunities •doesn’t have the traditional “college experience” that i’d want after cc •not sure if business admin would be too broad of a major to get job opportunities
0.412227	ucsb-pros •has a lot of social life and the students are one of the happiest in the country •have heard of people in the major who got jobs straight out of undergrad •get to live on the beach and do many activities with the rest of the students •is a bit far from where i live which can allow me to grow a bit more independent •accounting will show up on my degree
0.412227	ucsb-cons •have to pay about 10k after financial aid •doesn’t also have the prestige that ucla does •might have to also work a bit harder for opportunities •doesn’t have a dedicated business school to help guide me throughout undergrad •not the biggest fan of the actual campus but still need to visit in person •i’ve heard about there being a lack of diversity •also some weeder econ classes such as econ 10a
0.665118	Moving into new apartment
0.665118	My lease ends 6/19 but my new one at a different apartment starts 6/25, where do I leave my stuff in that 4 day period?? How does moving apartment to apartment work in IV 😭😭
0.411453	Dude in my building
0.411453	Dude in my building
0.411453	This guy im my building keeps leaving fucking bloodstains everywhere. Everyones complained like 1000x times and he just never listens. I swear to fucking god man its so nasty and it gets everywhere.
0.410743	come w me: chezile concert this friday in downtown sb
0.410743	pls pls pls someone come w me pls. tickets are still available at the site attached. i just know couples are gonna pull up and don’t wanna be there all by myself🥲💀.
0.410743	his ‘beanie’ and ‘blue’ are very popular on instagram.
0.410743	if u wanna come along dm me!!
0.410594	gifts for profs?
0.410594	im a soon to be graduating senior and i was wanting to get some of my favorite professors gifts as a thank you. is this allowed? and if it is, what gifts are recommended?
0.410463	Found Sunglasses
0.410463	I found a pair of Persol sunglasses in IV. Message me if you lost a pair and I can get them back to you unscathed
0.410165	Genuinely don’t know how to make friends
0.410165	I’ve been going to clubs, trying to make plans with people, even tried going out by myself— nothing’s been working. I haven’t been clicking with anyone and it seems like I don’t really have friends here. I’m only a first year but everything is already so cliquey and it feels like I’m intruding on friend groups in the clubs and such. Sure I have floater friends but usually I’m always making plans and they’re either cancelling or just not making plans back. I’d like to think I’m not that annoying or standoffish or anything and I feel like I’m decently social and confident I just don’t know what I’m doing wrong. I don’t have a friend group or even one or two close friends here. Even in classes I’ve been trying to make friends but it never goes outside of school work. I know it’s probably a lot my fault I think I’m doing something wrong and I usually only try to befriend people that look like someone I would get along with? Idk I don’t want to have socially peaked in high school and I miss having a friend group. My dorm hall is dead but there is someone I think is cool maybe I’ll knock on their door and ask to hang out idk maybe that’s weird maybe I won’t lol idk help
0.410033	If you’re class of ‘25, don’t forget to pick up your 4gb usb stick e-waste and plastic bag graduation gifts at stork plaza today
0.410033	The new chancellor’s comp is 800k tho
0.409786	Hey Transfer Students!!!
0.409786	Help Me With a Survey Transfer Students!!!!
0.409786	Attention Transfer Students: Please complete a short survey (part of ES’s ELI course) for a chance to win a $25 amazon gift card!
0.409786	My name is Isabella, a 4th year transfer student at UCSB enrolled in the Environmental Studies Environmental Leadership Incubator (ELI) class, and I want to hear about your experience when you first arrived at UCSB!
0.409786	As a transfer student, adjusting to a new environment—academically, socially, and physically—can be exciting but also overwhelming. I'd love your input on how you connected with UCSB’s outdoor spaces and community when you first got here.
0.409786	Please take a short survey to share your thoughts:
0.409786	Your feedback will be incredibly valuable in helping me develop a project aimed at making it easier for transfer students to explore UCSB’s natural surroundings, connect with the local environment, and build a sense of community.
0.409786	Follow me on Instagram or GroupMe if you want to know more about events!!!
0.409786	Instagram @ucsbhotby
0.409786	GroupMe https://groupme.com/join_group/107145148/TCCxWcoB
0.409786	Thank you for your time—I appreciate your insights!
0.409782	PLEASE SELL ME UR JUNE 15th @1 GRAD TICKETS PLEASE
0.409764	Fraternity Rankings
0.409764	I'm an incoming freshman planning on rushing first year, and what are the fraternity rankings?
0.409611	Rocky Horror Show UCSB student ticket
0.409611	hi i'm trying to get student tickets for the rocky horror show this week but it keeps saying my perm is an "invalid code." I know it's not because the ticket sold out because my friend who tried later than me had no problem getting her ticket. does anyone know why this is happening and how to solve it??
0.409426	Film style grad photos?
0.409426	Hi! I know I’m super late in the game but I’m looking for a photographer to do a grad shoot that has a film camera vibe - if that makes sense. I don’t need the photos to actually be shot on film, I’m just looking for a similar style to that or just a cinematic vibe - kind of like you took a screenshot from a movie. I’m a FAMST major hence the desire for cinematic / film style photos Thanks in advance!
0.409088	It’s adorable 🥰
0.408065	Anyone still have flashbacks from 2014?
0.408065	Hate to be a downer but on the 10th anniversary of the shooting I ended up having insomnia, panic attacks and migraines every day, and it's been for the past 11 months.
0.408065	We're coming up on the 11th anniversary. I've been on medical leave for this entire time because I haven't been able to work with this amount of sleep loss and anxiety. Does anyone else have these symptoms? It's weird that it manifested again after 10 years but I have the same fucking nightmare every single day, one hour of sleep, waking up sweating, stuck in my closet to calm the panic attacks because it's small and dark.
0.408065	James, George, David, Chris, I still can't get em out of my mind.
0.408065	I hope nobody is feeling the same way as I am.
0.406745	Is UCSB really that bad for premed?
0.406745	Hello all; I'm an incoming freshman currently deciding between UCR and UCSB. I just visited both campuses and the vibe I got from SB was insane. I know UCR is the more sensible choice as I have a scholarship there and it's got a medschool but I couldn't imagine giving up the location &amp; ppl of SB (especially as a nature lover). I don't think SB will be just as good as UCR for pre med because R is definitely quieter and easier to focus at, but I'm realizing people are saying it's actually really bad for premed. Mainly in terms of avoiding distractions, but also bc how limited opportunities are. I heard that pre med opportunities and hospitals are really hard to get positions at because of how many other pre meds are there, and how few hospitals there are. I'm sure this part is at least a little true, but is it sizeable enough to give it up entirely and go to UCR? (Also I'm from NC so I find riverside campus/area pretty nice compared to where I live now)
0.403783	picking a residence hall
0.403783	hi i just finished my housing app but i didn’t see anywhere where i could indicate residence hall preference, am i just blind or am i supposed to do that later?
0.403024	Is transferring to UCSB for economics worth it? from UCR.
0.403024	I'm considering transferring to UCSB. It is more prestigious than UCR, and the social life/location seems great. However, I don't know much about UCSB beyond that. Could current UCSB students, especially economics majors, share the pros and cons for UCSB. Also, if anyone knows what transfer life is like in UCSB, I'd love to know
0.402615	PSY 102 Baham Midterm
0.402615	How to study best?
0.402423	looking for grad tickets for sunday @1
0.402423	i need 5 extra tickets for the social sciences II ceremony on sunday june 15 @ 1pm. i’m willing to pay (within reason plss😭)
0.402423	dm me if u have any to offer! &lt;3 thank youuu
0.402109	UCSB vs Cal in difficulty
0.402109	Hi, I got accepted to both UCSB and UC Berkeley. I was wondering what the difficulty was academically speaking between the two universities, specifically when it comes to Earth science related majors. Also, I may want to go up to a graduate degree so I don't want to tank my GPA.
0.401779	pre-bio to pre-biopsych major switch advice w course planning !
0.401779	pre-bio to pre-biopsych major switch advice w course planning !
0.401779	i decided as a 2nd year just a week ago that i want to pursue the pre-biopsych route. i am hoping to go the pre-pa route as well. i did all the prerequisites except chem 109a/b/6al, eemb2/2ll, psy 1 and psy 10a/b and physics... any advice? additionally any advice w upper divs to take? i planned everything out for UD bio courses but now im switching to a different major and it feels like im starting new but the classes look so fun &amp; i feel more passionate for this route.
0.401779	i should be done with chem 109a/b, eemb2/2ll, psy 1 and psy 10a by the end of fall 2025 if all goes according to plan.
0.401779	any tips are very much appreciated tyty ! &amp; good luck w midterms everyone !
0.401686	Looking to sublease for summer
0.401686	I'm taking courses for both session A and session B and I want to sublease somewhere close to campus. Is anybody subleasing or know somebody who is subleasing for summer? I'm looking for a studio or single bedroom. What are good resources to find subleases? Thanks yall
0.401519	is there a way to get more tickets for grad ceremony
0.401519	please 🙏
0.400798	Want 2b1b/2b lease from Aug/Sep
0.400798	Hi there, we want to take the whole year lease for any quite Goleta apartment/house from August or September. Better with parking lots. Plz🙏
0.400715	Is senior year the hardest year in college?
0.400715	Im a current third year biopsych major, and I have been told that senior year is the hardest. Is that true???
0.400093	Switching majors (incoming freshman)
0.400093	Hi! I am attending UCSB this fall as a freshman, and I was wondering if it is possible to switch my major from psychological brain sciences to sociology before I begin school. If it is possible, what do I need to do to switch it?
0.400060	MS ECE 2025 admit, questions reg survival.
0.400060	Hi Gauchos, especially those from the ECE department!
0.400060	I'm an incoming international student to the department, but my decision to enroll is entirely contingent on how hard it is to get a TA/RA role—or any kind of employment or funding—that can make a decent dent in my student loans. This has been a lifelong dream, but I’m feeling jittery now because the current economic situation and the funding cuts are honestly pretty scary.
0.400060	So here are my questions:
0.400060	1. How difficult is it to get a TA/RA role in the ECE department as an MS student? From what I’ve seen in historical admit data (attached image) and the ~50 TA positions per quarter, it looked like almost everyone used to get one—until last year, when there was a big influx of admits. Is that influx going to make things harder for current enrollees? The admissions page does mention that incoming grad students are considered first, based on merit.
0.400060	2. About that “merit”—what exactly do they look at for TA positions? GPA?
0.400060	3. It’s surprisingly hard to find recent MS ECE students on LinkedIn (compared to other universities), even though the data shows there have been around 200 students in the past three years. Is that data even accurate?
0.400060	4. Are there any decent-paying options besides these? I may even drop the plan if I don’t seem likely to get anything. Or should I take a blind leap of hope, given the college reputation?
0.662022	pokemon go
0.662022	who else here plays pokemon go… got this badboy last night
0.399281	Looking for People Who Love THRIFTING!!!
0.399281	I’m a UCSB film student who is looking for INTERVIEWEES for my thrifting documentary!!! This documentary will focus on the creative aspect of recreation, the reuse of clothes/items that people thrift, and the value of thrifting. Recreation could entail adjusting the size of the clothes, cutting, mixing and matching of clothes, adding pieces/accessories to form a costume, or cleaning old/stained/rusted clothing/items to be useable again. I appreciate any creative works that bring a new purpose to the clothes/items you thrift! If you’re in Goleta or Santa Barbara, and you like thrifting, please message me! Come express your interest and be part of the documentary!!!✨🌷
0.399135	Incoming Masters Student Questions
0.399135	Hi guys, I was wondering if anyone has any advice for an incoming Masters Student doing Controls in ECE who did their undergrad in Applied Mathematics. Does anybody have any advice on coursework I should study before starting the classes in fall? Anyone have any resources they recommend? Do professors take in masters students for graduate research positions? I've only seen them have PHD students.
0.399107	‼️Burning questions for UCSB student‼️
0.399107	Help! I was accepted off the waitlist for ucsb (am committed to UCSD but heavily considering swapping to SB). I have a few questions that I haven’t really seen addressed much and wanted to see if anyone could help!
0.399107	1. For upperclassmen mainly: I understand the campus isn’t really close to downtown sb or any truly urban areas. Have you found yourself bored now that you are older and could perhaps be over the partying/frat scene you may have enjoyed your earlier years? Is that kinda the only thing to do there or do you guys just drive to further away bars or something? And also like aside from any partying aspect, do you get bored in general like not having any close by malls or like typical movie theaters or whatever else, having been there so long.
0.399107	2. Kind of going along with my previous question: does the food get old quick? If other restaurants are far away and may require a car, does it get hard to find places you enjoy eating on campus. I overall haven’t heard much about the food on campus.
0.399107	3. Santa Catalina/FT dorms: I have heard that waitlist students are more likely to be placed here rather than the on campus dorms (although I have no idea the validity of that statement). For those who live there, do you find it isolating from the campus community? A big pro of ucsb for me is how everything was very close together (vs UCSD where all the dorms are very spread apart and not cohesive). So if you were placed in the off campus dorm buildings has that significantly affected how connected you feel to the school/campus. I have spoken to a girl that lives there and she said she doesn’t mind it but finds herself rarely on campus by choice like she only goes in the mornings for class and then leaves. Is that the common case?
0.399107	4. The beach: I always hear the beach as a big pro of ucsb and how it‘s lovely to live right by it. I currently live in small beach town in CA and am about a five minute walk from the beach which I love. However I have heard that the Santa Barbara beaches aren’t really the type you can hang out at or swim in or lay out on the sand. It seems most people just occasionally go to watch the sunset. San Diego has beaches similar to where I am from so it is what I usually visualize when I hear “beach school” but it seems to not really be a big aspect of SB if you can’t even really go there. Have you found this to be the case? Are there beaches with actual sand to like lay out on nearby?
0.399107	If anyone has anything to add regarding these things it would be a big help thanks!!
0.397997	San Raf Housing
0.397997	Hiii, I’m planning to live in San Rafael next year, and I want to live in a 4- or 6-person suite. Do those only exist in the tower, or are they also available in the clusters? Or are the clusters mostly just singles and doubles?
0.397580	PASS/ NO PASS TRANSFER
0.397580	would pass/no pass be looked down upon im trying to transfer fall for next year &amp; was wondering if any of you guys had them on your transcript were you accepted as a transfer i am trying to TAG so its guranteed
0.397477	UC Santa Barbara Gauchos Squirtle Squad.
0.397477	Got this from here...... [https://creatorhutz.co.uk/?p=843](https://creatorhutz.co.uk/?p=843)
0.397265	Partial Tuition Refund
0.397265	Anyone else from the L&amp;S office get misinformed to fill out only one form for the course load deficit refund? I know it’s way past the 19th but I’m realizing now that they never told me to fill out the partial refund form when I went in person to ask.
0.397060	UCSB vs UCI for CS
