relevancy_score	text
0.600000	Helppp! Financial aid award
0.600000	Anyone have a similar award amount and can tell me how this money supposed to be disbursed? I plan to live off campus so I’m tryna get an idea of how much I would get refunded to my bank account each quarter to help pay for rent and other random expenses ? 🤗 and YES I plan to call financial aid office and ask as well 🙃.
0.600000	undergrad apartments
0.600000	btw if anyone wants to know whats left for housing theres spots available in santa ynez, sierra madre, and san joaquin. everything else is filled
0.600000	Econ 10A midterm 2
0.600000	How does everyone feel like they did on the test? I felt that the wording was super confusing.
0.599004	Please vote for my nephew to become the 2025 Jr. Ranger! (Not a survey or trying to sell anything)
0.599004	Please take a second to vote if you can, every vote counts! - Sincerely a UCD student trying to help my nephew out!
0.593554	quit cheating yourself---stop using chat gpt
0.852509	Orientation questions..
0.852509	Hi everyone im an upcoming freshman student and I am signing up for orientation and I have a few questions.
0.852509	1. Is orientation at UCSB a 2-day process? Or do I just have to get there on the day that I signed up, and then leave after everything is done? (There is an option for staying overnight which is why I'm confused)
0.852509	2. Why does orientation cost money? Ik it briefly explains this in the website on why there are fees, but there is no reason as to why it should cost 300+ dollars right? Is there anything I could do to lower the cost at least?
0.852509	Sorry for the questions yall just a bit confuzzled. Any answer would help.
0.575576	Looking to Purchase Commencement Tickets. June 14 1 pm
0.575576	Hey. Unfortunately as I have a big family flying in to SB for commencement I need 2 extra tickets for Math, Life &amp; Physical Sciences II Saturday, June 14, 2025 at 1:00 PM.
0.575576	If anybody has extra tickets, please let me know if you are willing to sell
0.563748	World’s biggest Raspberry Pi cluster is now at UCSB 👍
0.563748	A few years ago, as a demonstration of the power of a relatively simple technology, software giant Oracle built a cluster of 1,050 Raspberry Pi 3iPB+ computers.
0.563748	Now Oracle’s big cluster, the largest such assemblage ever built, has found a new home at UC Santa Barbara.
0.563748	The low-cost, low-power, credit-card sized machines are widely used, normally as individual units or in a small cluster of several units, to explore, learn and teach computing and programming, and to perform certain kinds of research-related computational tasks.
0.921411	Always go for it
0.552622	How to keep up with weight of everything
0.887525	DUI checkpoint
0.548162	Question for undeclared students
0.548162	Hello all, I just got off the waitlist at UCSB as an undeclared major and was wondering if you guys have any insight on the undeclared program and how good/bad it is. I’m currently at UCI but am leaning towards committing to UCSB. Thanks for the help!
0.543994	ucsb or cal poly slo?
0.543994	i’m currently committed to slo for journalism but i just got off the waitlist for communications at ucsb. ucsb has been a dream school of mine for years but since im already committed to slo im having doubts. i have plans to be a literary writer for a magazine or something like that but to be honest im really unsure about this. i feel like slo restricts my ability to “figure it out” because of their whole learn by doing motto. it basically means you take general and major-specific courses all four years, tying you down to your major like immediately. i also dont know if the “communications to journalist” pathway i’d follow at ucsb truly viable if thats the path i end up sticking to. ucsb will also be about 12k more for me. other concerns i have with both schools include the difficulty to get classes, dorm life, class sizes, connections, plus the party culture. are there a lot other social events to go to that aren’t just huge functions? i’d really really appreciate any advice or relevant information to help me make up my mind, thanks so much!
0.541354	Saving desks in library
0.541354	The entitlement is actually getting crazy, people need to remember that this is a shared public space. Unless your name is on the little name tags on the carrels you have no claim over it. Be considerate, we’re all trying to study.
0.536385	MCDB 126
0.536385	Can anyone who took this class before give me some info? I know it’s gonna be a very memorization heavy class but I’m willing to put the time in to study. Are Azarenko’s test fair and what’s her teaching style like. Thanks!
0.534303	Bear ecologist offers insight on recent sightings on and around campus 🐻
0.534303	A series of recent black bear sightings has the UC Santa Barbara campus and surrounding community buzzing with news and social media coverage.
0.534303	May 2025
0.532608	Transfer econ and accounting major
0.532608	Hi I plan to transfer to ucsb as a pre-econ and accounting major. I am aware that transfer students to need to get a b or higher in econ 10 and econ 5 but are there any alternatives to that?? i hear that if you get an a or smt in micro and macro, then you just need a 2.85 gpa?? help im so scared lol
0.532182	transfer for econ and accounting major
0.532182	i plan to transfer as a pre econ and accounting major. am i able to secure an internship for summer of junior year(incoming senior) at big 4 eventhough ill be an incoming junior
0.531545	HELP!! Summer Chem Courses at Community Colleges
0.531545	Does anyone know of chem courses (chem 1A and chem 1B) that can be taken at any CCs in the bay area or completely online? I've been trying to find one, but all the ones that I've looked at start in person before spring quarter ends.
0.525002	Looking for a subleaser for the summer, $850 rent for a double
0.524531	Thought it might be appreciated here.
0.523780	Should I fill out a petition to withdraw from one of my classes? (W on Transcript)
0.523780	So context, for basically more than half of spring quarter this year there’s been two things that have majorly happened to me that’s been really affecting how much and how well I can complete schoolwork.
0.523780	The first one being some of my financial information like my paypal account being compromised/hacked and having to deal with bank and financial problems that arose from that, leading to me having to deal with that tor a month and ended up deleting my paypal account. This event already sank my mental health into rock bottom and my anxiety sky high.
0.523780	The second major problem being that i suffered a concussion via a bike accident in the middle of the quarter that’s had to be treated for a few weeks now. Ive had to be taken to the hospital a few times now having to deal with said concussion and the lasting effects from it, while also treating other physical injuries on the rest of my body like deeps cuts and lacerations on my face specifically. The recovery process for the concussion is especially slow and requires me to not look at screens often which isn’t ideal considering we use canvas for basically everything now. And when i do try to work for extended periods of time i usually get awful migraines that make it especially hard for me to stand or walk, causing me to vomit.
0.523780	I’m mostly asking here first just to see and or clarify a few things:
0.523780	1. Should i mention both issues when submitting a petition to withdraw from one of my classes or just the concussion (as it does have physical paperwork attached to it)
0.523780	2. Are withdrawls counted as retakes? I’m a sophomore at the moment so I currently have zero idea of how withdrawls work or function or whatnot.
0.523780	3. If I were to apply for grad school would I have to explain why a W is on my transcript, and in the same vein does it make me look bad to have a W on my transcript in the first place?
0.523780	Any advice would be greatly appreciated regarding this topic, and i feel like my only three options are trying to tough it out and power through to try and make a comeback, intentionally fail and retake the class in fall, or submit a petition request like detailed above.
0.520632	I got off the waitlist! so convince me why I should go to UCSB or UCI
0.520497	UCSB Iceberg (Second Edition)
0.520497	Hello, again! Thank you all for the suggestions on the first Iceberg. I had to read for a few hours on every suggestion and put them in!(with just a handful of exceptions(insufficient data)). I swapped around some of the items in the original meme to fit a more consistent gradient as shown in the second pic. If there are any more additions you would like to see or dispute the placement of certain elements, feel free to comment and lmk! (The harmless-&gt;dark gradient is not objective, so it is subject to some inconsistencies based on perspective)
0.520497	Special thank you to u/spica_9, u/kajonn u/timoperez u/Snoo29444 u/likedirk u/engenapproved u/Hambone482 u/beetling u/doodle_sm u/sagisuncapmoon u/nachos_da_dog u/Mcrossover u/CompleteChemical4094 u/dantes_02 u/JDawg2332 u/WorldCatastrophe u/nqrze u/BackdoorDan u/eric-neg for all the suggestions!
0.520480	UCSB Iceberg (Second Version)
0.515670	Do you guys know if I withdraw from the class, will the next time I take it count as my first or second attempt?
0.515147	Giving up hope on getting off the waitlist
0.515147	I applied for theater as a transfer and got waitlisted. It’s been a few weeks and we only have until June 1st so my hope is quickly dwindling ☹️
0.515147	I can’t stay at my current school, I don’t know what I’m going to do
0.000000	Bypass code
0.513470	Average UCSB pre-major student trying to sign up for high demand classes out of their Pass time (me)
0.513405	Exceptional Academic Performance Award
0.513405	Anyone know why I received this award? Specifically, the criteria to get this?
0.683924	Housing
0.683924	I'm in kind of a bad spot right now, I got bailed on by my planned housemates and now I'm scrambling to find something, any advice?
0.512562	Sections Vigoda/CMPSC 130A
0.512562	Are sections mandatory for CMPSC 130A with Eric Vigoda?
0.510245	going over 200 credits
0.510245	hi, im a transfer and I transferred in with 133.5 units from my cc. basically fucked around taking a bunch of classes trying to figure out what I was gonna stick with 😭 im calculating how many units i’ll be taking by the end of my time here and its looking like about 240… is this allowed and if not wtf do I do
0.509694	Residence Halls
0.509694	i’m going to be transferring to ucsb from a community college this fall and was wondering which residence hall would be the best? so far i’ve heard that FT is good and mazi is good but also kinda anti social (which does not sound appealing)
0.508541	am i getting rescinded
0.508541	am i getting rescinded for a senior year gpa below 3.0 😭😭😭😭😭😭
0.504884	Chem Waitlist
0.504884	Bro ts got me stressing like I saw a bunch of CS ppl got off the waitlist but I did not see any pre-chem or chem major people got off the waitlist. Has anyone got off the waitlist for chemistry major and how competitive it is?
0.504138	UCSB Iceberg (First Edition)
0.504138	As per u/spica_9, this is my take of the UCSB Iceberg Meme based on my experiences and things I overheard on campus. Feel free to correct or add suggestions
0.669535	Can I graduate with a D- in a major elective class?
0.501550	100b study tips
0.501550	Hey guys how are you guys learning for 100b? going to lecture? are there any youtube playlists like for 10b z:D lol i rdgaf about the econ classes the econ department is terrible these classes i just rlly dont care abou tit so i rarely touched 100b this quarter. been just asking chatgpt to teach me how to do the practice exam questions but i feel like it does it in sucha roundabout way that its no efficient. thanksss.
0.500118	Comm Major Insight
0.500023	Communication Major Insight
0.499964	Communication Major Insight
0.499943	Comm Major Insight
0.499836	water rescue DP?
0.499836	does anyone know what’s going on?
0.499825	water rescue DP?
0.499825	does anyone know what’s going on?
0.499129	voting
0.498342	When do I(Incoming Freshman) need to find my roommates by
0.732580	Commencement ticket available (14th 9:00am)
0.732119	Classes for History of Public Policy &amp; Law
0.497782	Does anybody have their MCDB 126A + 126B syllabus from Fall/Winter?
0.497782	I signed up to take 126A in fall 2026 and I'm trying to figure out when midterms are most likely to be! Also would appreciate any tips or advice for the course :)
0.497263	Courses that count as econ electives from other departments?
0.497263	Is there any courses from other departments I could petition to count for UD econ electives? I did this with Economic Geography but idk about other classes.
0.497100	Birchenall, Benelli, Ebenstein, Lowel Econ Electives
0.497100	Amongst these 4 professors, which were the best? I just need two econ electives for Fall 2024. It's between international trade (lowel), economic development (birchenall or benelli), and 20th century econ history (ebenstein). What classes/professors seemed most interesting/relatively easy?
0.496222	sierra madre: 4 people/2 doubles
0.496129	how to get to the police station
0.496129	i'm trying to get to the UCSB police station but the vicinity seems to be blocked due to some construction and i cant follow the path google maps is showing me. how else can i get there?
0.495865	UCSBMax???
0.495865	Just got an email notifying me that I was invited to the UCSBMax program, was wondering how it works exactly and if it's worth it, especially with the kinda steep fees.
0.000000	Thought it might be appreciated here.
0.494614	It was a gift and I really liked it!
0.493870	Any easy courses from this list?
0.493668	Too chopped to go here
0.493668	Saw the 2029 account and everyone a baddie. Committed but lowk scared cuz im chopped hella
0.485198	BEWARE OF REC CEN HOT TUB LADY
0.485198	so multiple people i know have gotten scammed by a woman named arden rose who likes to hang out in the rec cen hot tub. she offers to be your "mentor" in exchange for an unreasonable amount of hours you spend being her personal caregiver (unpaid). she is extremely manipulative and narcissistic. i've gotten fooled and so have many others so please be careful! old people are not always so innocent!
0.484955	Negative Student Health Experiences?
0.645795	Off Campus Housing vs SD/Davis
0.645795	Hey y’all I’m a prospective transfer student and I just had a quick question about transferring.
0.645795	Rn I’m deciding between Davis, SD and SB, and I really wanna do SB but I’m not sure about housing. I understand transfers get one year guaranteed and then are on their own, so my question is how expensive is off campus normally and how hard is it to find a place?
0.645795	SD and Davis both do 2 years guaranteed and since I don’t get any financial aid, does anybody know if SB’s 1/1 housing is way more expensive than the other UCs 2 years?
0.483031	which professors for math 104a and pstat 160a?
0.483031	104a: Yan, Su, Yang 160a: Ichiba, Palanippan
0.482483	Easy survey for students, free gift cards!
0.482153	Biopsych Major
0.482153	Hi, I am currently a pre-biopsych major and I was wondering what classes I should take throughout the years because I looked through the major sheet. What order should I take certain classes? Who are the best professors for each class?
0.733980	How hard is it to maintain a GPA of 3.5 or more in environmental science?
0.733980	I have been told by a number of people how hard it is to maintain a good GPA in most STEM degrees. How difficult would it be to maintain a GPA of 3.5 or more in either the BA or BS in Environmental science?
0.470931	does anyone know what all the sirens are about?
0.470931	west IV, hearing tons of sirens, police, ambulance, fire etc
0.469086	A few questions about working on or near campus
0.469086	Hey everyone, so I currently work on campus at my community college I'm at now, but I'm planning on transferring to UCSB. So I've got a few questions.
0.469086	What jobs are available for students to work on campus or near campus? How hard is it to get these jobs? How much time does it take up, and are you able to do all you need to do for your classes?
0.464940	Does anyone know of anywhere in IV that has keto food options? Or any drinks that are keto.
0.464940	I wish blenders had a keto smoothie
0.671661	Temporary Fall Quarter ‘25 Roommates?
0.448298	bear tracks westward!
0.448298	big momma swam across the lagoon to the west
0.444408	WILL PAY- Extra Tickets to L&amp;S Grad II on June 15
0.444408	Does anyone have 2 extra tickets to the L&amp;S II ceremony on June 15th at 1pm they aren’t using? I have some extra family flying in and I would love for them to attend! I would be down to exchange for cash on Venmo, thank you so so much!
0.440904	anyone down for early morning jogs? ~11m pace
0.440904	ive been slowly working on getting into jogging and rn i can do one or two miles at 11m pace with some pauses. seen some recs for run club but not sure if anyone is at that pace since it’s fairly slow. would anyone be down to jog in the early mornings around 6am? im a guy if that matters
0.440892	Anyone down for early morning jogs? ~11min pace
0.440892	ive been slowly working on getting into jogging and rn i can do one or two miles at 11m pace with some pauses. seen some recs for run club but not sure if anyone is at that pace since it’s fairly slow. would anyone be down to jog in the early mornings around 6am? im a guy if that matters
0.439277	CS Major requirements... nuked?😳24-25 GEAR
0.439277	So I've been advising a much younger friend of mine about courses in the CS department, and I noticed that the 2024-25 GEAR doesn't require new CS majors to take.... really anything in particular anymore 😱😱😱! So you can graduate the CS major without taking, for example, computer architecture or operating systems? Maybe even duck out of theory of computation(though ig it's still a prereq for like a dozen courses)? I'm sure students are jumping for joy at dumping PSTAT 120B in the gutter, though I suppose students affected by the above are not even aware of the horror they have narrowly avoided.
0.439277	Can anyone (meaning u/pconrad0) explain the thought process of whatever committee is responsible for these rather drastic changes? I am curious 🤔
0.438758	Computer Science Classss
0.438742	CS Classes
0.431095	Computer Science Classes For Upcoming Fall Quarter
0.431095	Computer Science Classes For Upcoming Fall Quarter
0.429891	Daily Nexus Grade Distributions UPDATED!
0.429891	Daily Nexus has updated their grade distribution to reflect all courses up till last quarter (Winter 2025)! That means you can see more up-to-date grade distributions in courses as well as those now taught by new professors!
0.427365	Found at Estero Park
0.427365	Found this guy on the ground by the path. DM me if he belongs to you.
0.427266	Where are ppl selling their stuff now that UCSB Free &amp; For Sale is gone?
0.427266	I'm starting to clear out some of my stuff in my apartment since i'm gonna graduate. Usually I would post it on that facebook group but now that it's gone where are people posting their stuff?
0.427243	What will get you to go to an event by yourself?
0.427243	Would it be food? Career interest? The event's purpose? Resource learning? Getting a free shirt or tote bag? Get together with your major? Music? Sit down QnA with administration?
0.426237	Where can a man get a banana?
0.426237	I'm fresh on EBT, where can I just get a fruit or two on campus instead of my choice of takis takis doritos ramen ramen ramen ramen plastic ham and cheese sandwich ramen ramen and rockstar from the Arbor?
0.426129	Is SLR always such a pain?
0.426129	I swear to god I feel like I’m being trolled by the registrar’s office.
0.426129	I’ve lived in California for almost 5 years, I’ve graduated from high school in California, went to community college (while paying in state tuition) in California, paid my taxes here since 2022 (haven’t filed before).
0.426129	I have sent my budget and W2’s verifying my financial independence, I have submitted my immigration documents, I have submitted my tax returns (that show I’m in California continuously), submitted my car registrations (all in my name), my drivers license, my residential parking permits. At this point I’ve submitted like 20 documents to them, along with signed statements.
0.426129	I have never received this much scrutiny at a CA community college. Is this just a UCSB-registrars-office thing or are all UCs like this? I’m so tired atp lol
0.426016	is there any one saw the bear in I.V?
0.426016	Can you share me some pics?🥺
0.426003	Anyone successfully match the Cognitive Science major that UC Davis offers with something at UCSB?
0.426003	The Psychological and Brain Sciences major has been suggested but it doesn’t really match up with the cognitive science major that is offered at every other UC. Anyone at UCSB now that has figured out how to match that major? The counseling office basically said it’s impossible.
0.425791	AS Elections 🚨
0.425682	AS elections
0.424884	Looking for roommates for Santa Ynez apartments
0.424884	Hey guys, I got housing for session A and B through the university for this summer in Santa Ynez, and I was wondering if anyone would like to be roommates. I have had a bad experience with one of my random roommates, and I would like to avoid hating my summer.
0.424884	If anyone is interested message me to my Insta: cris\_pybacon06
0.424768	Random roommate experiences?
0.424768	Hi! Incoming freshman, was just wondering if people could share their experiences going with random roommates? Did it end up going good or bad?
0.424758	Has anyone gotten their Partial Fee Reduction reduction yet?
0.424034	Too late to find good housing
0.424034	Hello, I am an incoming sophomore who did not get a housing contract for 25-26. Was going to live with a friend in IV but unfortunately bailed on me last minute. Tried FB groups but they either do not have a Sep move in date or are wayyy out of budget for me ($1200). In a massive pickle right now and am really hoping to get some advice moving forward. Been super stressed about it for a while.
0.423686	Student Standup Showcase this Saturday (5/10) at Embarcadero Hall
0.423686	Hi yall! If anyone hasn't heard about this yet and is looking for Saturday plans we have a FREE standup show (funded by your student fees) this Saturday at 8pm. The show usually lasts from 8-10pm and will feature \~15 student performers. If you've ever been at the open mic, it will be a lot like that but with more refined, worked on sets and (hopefully) a much better energy. It is 100% open to all students, community members, faculty, or whoever walks through the door.
0.423493	Math 8 at SBCC
0.423493	SBCC is offering Math 8 this summer with one of the math department’s best professors (called math 180 in their course catalog, but it’s the same class) If you need to take math 8, this is a great opportunity to get the credits.
0.423365	Looking for ppl to play music with
0.423365	I looking for ppl to jam with. I used to play guitar but have been on break for a while and would like to get back into. Im down to play anything, jazz, blues, rock, funk, typical guitar stuff. hmu if your down.
0.423060	friends!
0.423060	hi everyone! i recently got admitted to ucsb as a transfer (yay)! im a data science major and was hoping to make some friends before the school year started (ps also looking for a roommate!)... + im looking for club/extracurricular recommendations too!
0.423060	some things about me... im originally from the bay area, but for freshman and sophomore year i went to ASU for CS.
0.423060	im pretty introverted and am not a partier, but i love exploring nature and am stoked about going on hikes and taking beach walks! i heard ucsb has some tide pooling spots nearby, and am so so excited to hopefully visit some.
0.423060	ive been trying to get back into reading, and adore mystery books. i also like board games, but havent had as much time to play recently. i enjoy baking but im still a beginner (so any cooking classes/clubs would be super interesting), and even better than making my own food is eating food, so im totally open to any restaurant and cafe recs as well!
0.423060	if anyone here shares similar interests, i would love to get to know you so shoot me a message or comment! i would also appreciate any recommendations or general tips! ty if you read this far and sorry if this was a long post 🥲🥲
0.423046	How to find a roommate?
0.423046	Hi, I’m an incoming freshman and have like no clue on how to find a roommate! I’ve seen those class of 2029 pages but I’m wondering if that’s the only way? Let me know! I’m a guy, if anyone here is also looking for a roommate but ya!
0.423002	Lease Takeover
0.423002	I’m looking for someone (preferably a woman) to take over my spot on a lease in a 4 bedroom house on cathedral oaks rd. You would be living with three first year phd women in the Materials department at UCSB. The room is sizeable (can fit a full bed and a desk) and the house has a pretty nice garden (avocado, and lemon trees). There is laundry and parking on site. The rent would be $1200 + utilities. Please let me know if you, or anyone you know, would be interested. Lease can start in June but move in available in May if you wanted to.
0.422287	any good thrift shops in Goleta/dt sb?
0.422287	Hey guys!
0.422287	Im going to edc next week and I need to find some nice clothes for it lol. Im also broke so is there any thrift stores that y'all recommend?
0.421135	Move In Day and Family Weekend Questions
